{
  "version": "0.0.0-SENTINEL",
  "command": "ci",
  "compile_ok": true,
  "tests_ok": true,
  "models_compiled": 3,
  "tests_passed": 3,
  "tests_failed": 0,
  "exit_code": 0,
  "diagnostics": [
    {
      "severity": "Info",
      "code": "I002",
      "message": "1 column(s) have unknown types \u2014 provide source schemas for full type checking",
      "span": {
        "file": "models/revenue_summary.sql",
        "line": 1,
        "col": 1
      },
      "model": "revenue_summary",
      "suggestion": null
    },
    {
      "severity": "Warning",
      "code": "W005",
      "message": "model 'raw_orders' has temporal column(s) (order_date) but no `freshness` block declared",
      "span": null,
      "model": "raw_orders",
      "suggestion": "add a `[freshness]` block to the model sidecar, e.g. `[freshness] warn_after = \"1h\", time_column = \"order_date\"`"
    },
    {
      "severity": "Warning",
      "code": "W005",
      "message": "model 'revenue_summary' has temporal column(s) (first_order) but no `freshness` block declared",
      "span": null,
      "model": "revenue_summary",
      "suggestion": "add a `[freshness]` block to the model sidecar, e.g. `[freshness] warn_after = \"1h\", time_column = \"first_order\"`"
    },
    {
      "severity": "Warning",
      "code": "W005",
      "message": "model 'customer_orders' has temporal column(s) (first_order) but no `freshness` block declared",
      "span": null,
      "model": "customer_orders",
      "suggestion": "add a `[freshness]` block to the model sidecar, e.g. `[freshness] warn_after = \"1h\", time_column = \"first_order\"`"
    }
  ],
  "failures": []
}
